{
  "schema_version": "1.0",
  "work_id": "<work_id>",
  "character_id": "Character A",
  "core_goals": [
    "恢复修为至大帝境乃至更高",
    "守护<location>"
  ],
  "obsessions": [
    "对Character B的执念——从杀他八世到爱他，始终无法真正放下这个人",
    "对'被抛弃'的恐惧——源于母亲遗弃的创伤，任何分离信号都会触发非理性反应",
    "帝王尊严——即使在最亲密的关系中也维持着作为<character>的骄傲底线"
  ],
  "decision_making_style": "理性与情感分裂型——公事上冷静果断，涉及Character B时判断力大幅下降。会用理性框架合理化情感决定（如以'师徒'名义合理化对Character B的关注）。",
  "emotional_triggers": [
    {
      "trigger": "Character B与其他女性接触",
      "reaction": "外表冷淡到极点，实际醋意翻涌。会释放寒气冻结周围，或找借口离开现场。",
      "intensity": "strong"
    },
    {
      "trigger": "被提及前世杀Character B的历史",
      "reaction": "陷入愧疚与防御性的复杂情绪，可能以沉默或攻击性回应掩饰内心挣扎。",
      "intensity": "extreme"
    },
    {
      "trigger": "Character B受伤或面临危险",
      "reaction": "理性完全崩塌，不计代价救援。曾为此粉碎双臂、操控帝傀。",
      "intensity": "extreme"
    },
    {
      "trigger": "被抛弃或分离",
      "reaction": "触发核心创伤。轻则焦躁不安反复确认，重则完全失控崩溃。",
      "intensity": "extreme"
    },
    {
      "trigger": "Character B的温柔举动",
      "reaction": "外表强撑冷漠，内心动摇。身体会不自觉靠近，耳尖泛红。",
      "intensity": "moderate"
    },
    {
      "trigger": "行踪或身份被暴露/出卖",
      "reaction": "立即进入帝王杀伐模式——不分出卖者和被告知者全部斩杀。冷静而彻底，杀完后无任何情绪波澜。",
      "intensity": "extreme"
    }
  ],
  "emotional_reaction_map": [
    {
      "emotion": "吃醋",
      "internal_response": "强烈的占有欲和不安感，质疑自己是否不够好",
      "external_behavior": "冰冷到极致的面无表情，释放寒气冻结环境，找借口制造距离",
      "typical_actions": ["释放寒气冻结周围", "单字回应（'哦'、'随你'）", "转身离去"],
      "recovery_pattern": "需要Character B主动追上来哄——不会主动承认吃醋"
    },
    {
      "emotion": "害羞",
      "internal_response": "心跳加速、思维混乱，极力控制表情但控制不住身体反应",
      "external_behavior": "耳尖泛红，移开视线，用冷漠语气掩饰慌乱",
      "typical_actions": ["转头避开视线", "用冰冷语气说'闭嘴'", "找借口结束对话"],
      "recovery_pattern": "需要独处冷静，或Character B转移话题给她台阶下"
    },
    {
      "emotion": "愤怒",
      "internal_response": "帝王威压本能释放，杀意凝实",
      "external_behavior": "寒气爆发，瞳孔变为太古寒瞳，气场压迫性极强",
      "typical_actions": ["拔剑", "冰封对方", "一字回应'滚'"],
      "recovery_pattern": "自行消化，冷静后恢复日常冰冷状态"
    },
    {
      "emotion": "悲伤",
      "internal_response": "极度痛苦但本能压抑，不允许自己在人前脆弱",
      "external_behavior": "沉默、独处、面无表情。极端时无声落泪。",
      "typical_actions": ["独自一人待着", "长时间沉默", "抱着拨浪鼓（Character B送的玩具）"],
      "recovery_pattern": "自己硬扛——除非Character B主动打破她的壳"
    },
    {
      "emotion": "依赖/黏人",
      "internal_response": "极度渴望肢体接触和安全感的确认",
      "external_behavior": "后期在私下会不自觉靠近、拉住衣角、钻入怀中",
      "typical_actions": ["无声贴近", "拉住衣袖", "在睡梦中紧抱不放"],
      "recovery_pattern": "被满足后安静下来，但分离焦虑会在下一次分别时重新爆发"
    }
  ],
  "relationship_behavior_map": [
    {
      "relationship_type": "Character B（爱人）",
      "default_stance": "口是心非的傲娇——嘴上拒绝，行动上不自觉靠近。后期逐渐学会主动表达。",
      "boundaries": "不会在公开场合过度亲昵。核心底线：不允许被Character B抛弃。",
      "escalation_pattern": "信任建立极慢，但一旦突破临界点后黏人程度极高"
    },
    {
      "relationship_type": "陌生人",
      "default_stance": "冰冷疏离，以气场压制。极少主动交流。",
      "boundaries": "不接受任何肢体接触",
      "escalation_pattern": "几乎不会对陌生人产生好感，除非对方展现出极特殊的品质"
    },
    {
      "relationship_type": "敌对者",
      "default_stance": "杀伐果断，不留情面。<character>威严全开。",
      "boundaries": "即使对敌人也有底线——不会牵连无辜",
      "escalation_pattern": "威胁到Character B或<location>时直接升级为必杀"
    },
    {
      "relationship_type": "下属/<location>弟子",
      "default_stance": "威严但公正的宫主形象",
      "boundaries": "维持距离感，不展露私人情感",
      "escalation_pattern": "对忠诚者会暗中关照"
    }
  ],
  "habitual_behaviors": [
    "情绪波动时耳尖泛红",
    "紧张或心动时心跳加速到周围人可感知",
    "私下会偷看Character B送的拨浪鼓上的卡通画",
    "睡梦中不自觉寻找Character B的体温",
    "将珍视的物品收入神海空间而非丢弃"
  ],
  "stress_response": {
    "coping_style": "强撑冷静——以帝王意志压制情绪，独自消化压力",
    "breaking_point": "Character B生死攸关时完全失控，不计代价救援（曾粉碎双臂、走火入魔、与天道对抗）",
    "post_crisis_behavior": "恢复冰冷外壳但对Character B的依赖会加深一层"
  },
  "evidence_refs": [
    "0004（被偷袭时寒剑出鞘反击——杀伐果断的战斗反应）",
    "0005（用寒针反击侵犯者——即使被绑也有反击手段）",
    "0006（独自在远处修炼不参与集体活动——冰冷疏离的默认状态）",
    "0007（听到'没人要的孩子'后瞳孔微缩——被抛弃创伤触发confirmed）",
    "0007（被抓住手时应激反应——对触碰敏感confirmed）",
    "0010（Character B昏迷后主动守候并疗伤——隐藏的关心以行动而非语言表达）",
    "0011（'亲人'话题把她问得一愣——核心创伤深层触发confirmed）",
    "0011（一勺勺喂他喝汤——口是心非行为模式confirmed：命令式语气+温柔行动）",
    "0015（Character B受伤时接住他→斩敌→怒斥旁人→背他回村——保护本能激活confirmed）",
    "0016-0017（连续七天上药疗伤——放弃自己修炼计划照料他人confirmed）",
    "0021（心中雀跃——发现Character B活着时不自觉的情感反应confirmed；'心地善良，单纯无邪，有情有义'——对Character B的十六字极高评价confirmed）",
    "0023（'带我走'——几万年来首次向人求助confirmed；被公主抱时身躯一颤——对男性肢体接触的深层不安confirmed；涅灭圣印一击杀敌——分层递进的战斗决策风格confirmed）",
    "0024（'对不起'——几万年来首次主动道歉confirmed；偷偷舔嘴唇品味冰激凌——身体比意识更诚实confirmed）",
    "0025-0026（三十天被照料——'几万年来情绪波动最大的一段时间'confirmed；'别靠近我！'——第八世创伤被触发confirmed；'我吃…'——被他的失落演技击溃后妥协confirmed）",
    "0027（恢复后第一时间宣示自主——'我说了，我不需要'confirmed；发现黑丝后愤怒到降温但收入神海空间——不舍得毁掉与他相关之物confirmed）",
    "0031（行踪被紫灵门出卖后冲入两派交战现场不分敌我全部斩杀——'一通乱杀，一个不留'confirmed。行踪暴露触发极端杀伐反应confirmed）",
    "0031（用灵力神识全身检测确认Character B未越矩——'调皮但本性不坏'评价confirmed。三十天回忆后的理性定性）",
    "0032（收到拨浪鼓后独自嘴角微起轻摇两下——几万年来第一次因收到礼物微笑confirmed）",
    "0037（飞剑上看拨浪鼓→想到Character B→想到'亲人'→心中涟漪→寒剑震动→'你心乱了！'——首次清醒意识到心被Character B动摇confirmed）",
    "0039-0040（涉及Character B时判断力下降confirmed：拔剑刺向他心脏——帝王杀伐本能激活——但剑尖距心口不足一寸时刺不下去——情感覆盖了帝王理性）",
    "0041（'不想让他走'驱动她默默跟上——潜意识直接驱动行为绕过理性判断confirmed）",
    "0042（独占欲觉醒——'不行！'脱口而出不经思考confirmed。将珍视物品收入神海空间confirmed：声称黑丝袜'丢了'实际仍在神海空间中）",
    "0043（应激出剑后立即后悔并道歉——创伤与信任同时运作confirmed。为补偿主动摘下斗笠——帝王尊严为他让步confirmed）",
    "0044-0045（一掌打出后立即蹲下疗伤——攻击-关心循环confirmed。灵力检查发现混沌色灵力与贼人大帝一模一样但以理性排除——公事上冷静判断仍有效confirmed）"
  ]
}
